{
  "workstream_id": "ws_thread_graph",
  "goal": "把单线程恢复卡扩成可串联的线程工作图",
  "anchor_focus_name": "buildThreadWorkstreamGraph",
  "root_thread_id": "thr_skill_source",
  "nodes": [
    {
      "thread_id": "thr_skill_source",
      "title": "收敛 SkillCardExtractor.resolveSkillSource 的技能来源识别",
      "focus_name": "SkillCardExtractor.resolveSkillSource",
      "focus_type": "方法",
      "status_key": "done",
      "status_label": "已完成",
      "workspace_path": "G:/temp/codex-thread-focus-cards",
      "context_refs": [
        {
          "kind": "skill",
          "label": "$pua",
          "path": "C:/Users/90778/.codex/skills/pua/SKILL.md"
        }
      ]
    },
    {
      "thread_id": "thr_graph_domain",
      "title": "补 buildThreadWorkstreamGraph 的关系类型",
      "focus_name": "buildThreadWorkstreamGraph",
      "focus_type": "函数",
      "status_key": "editing_object",
      "status_label": "在改对象",
      "workspace_path": "G:/temp/codex-thread-focus-cards",
      "context_refs": [
        {
          "kind": "workspace",
          "label": "thread graph prototype",
          "path": "G:/temp/codex-thread-focus-cards"
        }
      ]
    },
    {
      "thread_id": "thr_plugin_experiment",
      "title": "试 CodexSidebarThreadMap.renderGraph 的侧边栏实验",
      "focus_name": "CodexSidebarThreadMap.renderGraph",
      "focus_type": "方法",
      "status_key": "reading_interface",
      "status_label": "在看接口",
      "workspace_path": "G:/temp/codex-thread-map-plugin",
      "context_refs": [
        {
          "kind": "repo",
          "label": "plugin repo",
          "path": "G:/temp/codex-thread-map-plugin"
        }
      ]
    },
    {
      "thread_id": "thr_repo_validation",
      "title": "跑 GET /api/thread-workstreams 的跨目录验证",
      "focus_name": "GET /api/thread-workstreams",
      "focus_type": "路由",
      "status_key": "running_verification",
      "status_label": "在跑验证",
      "workspace_path": "G:/work/app-server",
      "context_refs": [
        {
          "kind": "repo",
          "label": "app server repo",
          "path": "G:/work/app-server"
        }
      ]
    }
  ],
  "links": [
    {
      "from_thread_id": "thr_skill_source",
      "to_thread_id": "thr_graph_domain",
      "type": "skill_source",
      "label": "技能来源",
      "reason": "这个线程在读 $pua 技能定义，目标线程在把状态描述规则接进工作图模型。",
      "confidence": 0.98
    },
    {
      "from_thread_id": "thr_graph_domain",
      "to_thread_id": "thr_plugin_experiment",
      "type": "next_step",
      "label": "下一步",
      "reason": "领域模型定完后，下一步是在插件目录把图接到侧边栏。",
      "confidence": 0.95
    },
    {
      "from_thread_id": "thr_graph_domain",
      "to_thread_id": "thr_plugin_experiment",
      "type": "workspace_handoff",
      "label": "跨目录接力",
      "reason": "工作从 G:/temp/codex-thread-focus-cards 转到 G:/temp/codex-thread-map-plugin。",
      "confidence": 0.96
    },
    {
      "from_thread_id": "thr_plugin_experiment",
      "to_thread_id": "thr_repo_validation",
      "type": "verification_branch",
      "label": "验证分支",
      "reason": "侧边栏实验完成后，要到 app server 仓库验证真实接口返回。",
      "confidence": 0.91
    },
    {
      "from_thread_id": "thr_repo_validation",
      "to_thread_id": "thr_plugin_experiment",
      "type": "blocked_by",
      "label": "受阻于",
      "reason": "验证线程还要等插件线程先把渲染入口接好。",
      "confidence": 0.89
    }
  ],
  "frontier": {
    "active_thread_ids": [
      "thr_graph_domain",
      "thr_plugin_experiment"
    ],
    "blocked_thread_ids": [
      "thr_repo_validation"
    ],
    "parked_thread_ids": [
      "thr_skill_source"
    ],
    "next_suggested_thread_id": "thr_graph_domain"
  }
}
